{
  "$schema": "http://json-schema.org/draft-07/schema#",
  "type": "object",
  "required": ["device", "class", "measured", "competence_tier", "system_matching", "warnings"],
  "additionalProperties": false,
  "properties": {
    "device": {"type": "string"}, "class": {"enum": ["dac", "amp", "dac_amp", "dap"]},
    "measured": {"type": "object", "required": ["sinad_db", "thdn_pct", "snr_db", "zout_ohm"],
      "additionalProperties": false,
      "properties": {"sinad_db": {"type": "number"}, "thdn_pct": {"type": "number"},
        "snr_db": {"type": "number"}, "zout_ohm": {"type": "number"}}},
    "competence_tier": {"enum": ["transparent", "very_good", "adequate", "compromised"]},
    "system_matching": {"type": "object",
      "required": ["target_z_ohm", "damping_factor", "damping_ok", "max_spl_db", "drives_adequately", "hiss_risk"],
      "additionalProperties": false,
      "properties": {"target_z_ohm": {"type": "number"}, "target_sens_db_mw": {"type": "number"},
        "damping_factor": {"type": "number"}, "damping_ok": {"type": "boolean"},
        "max_spl_db": {"type": "number"}, "drives_adequately": {"type": "boolean"},
        "hiss_risk": {"enum": ["low", "medium", "high", "unknown"]}}},
    "warnings": {"type": "array", "items": {"type": "string"}}
  }
}
